,text,time,hashed_value
323,@Kenichan *sends pick me up and smile vibes* I sawwie day is crappy ,,
324,someone is hacking my account ,,
325,My car is still broken   I have places to go and people to see,,
326,"preparing for documentary filming later, office ready, staff ready, but construction crew destroying the sidewalk just outside our door ",,
327,"@caosmoker - Its about 100 miles between us, with nowhere significant in the middle!   Any ideas?",,
328,I want to watch Transformers. ,,
329,When it rains it pours ,,
330,exhausted and I am really achy!! ,,
331,"@msilve Awwww, that stinks that you feel worse!  But yes, I am there in spirit making you Italian food, okay?&lt;3333",,
332,i really really hope my Mama gets better ,,
333,Twitterfon just doesn't appear to be working for me today. ,,
334,Day 2 :: my tummy hurts ,,
335,duduk  manis dengerin debat capres.. makin gak simpati aja liat megawati .. ,,
336,"@Ismahyus OMG! Really? Nobody tell me, you know. Somemore my printer baru habis ink. ",,
337,"is on the bus going home, and a little pissed that none of the quizzes will work on her cell phone ",,
338,woke up to a spider dangling right above my head. i screamed. it fell. i think i swallowed it. ,,
339,sad that its sch to rain in west palm for my concert saturday ,,
340,Spoke too soon. One surgeon in behind closed doors. I thought they were only going to look at my foot and not chop chunks out of it ,,
341,Tireeeddddd. ,,
342,It's too early to be at work ,,
343,"OUCH ..Left my Kindle on Jet. If you are reading it now, judge me for the Ben Franklin biography, not the 15 books on self improvement. ",,
344,Waiting on phone repair man. Hoping to have my phones working soon  Also praying this is a better day,,
345,last day at the beach ,,
346,Last day in nyc ,,
347,@Bookgal link didn't work. ,,
348,People are talking bad about the movie Transformers  I guess ill be the judge of that. Going to see it this morning....,,
349,"@__zues I'm so malas. OMG Mi, lama tak jumpa, but I'll go for the sake of  you. Lala tak pergi tapi pls ",,
350,"@feylya Aww that's sweet, but I'm afraid the feeling is not mutual... ",,
351,@awalker2334 I'm sorry for your loss. ,,
352,Awwwww so cuteeeeeeeeeee! I miss parry!  - http://bit.ly/FLAI5,,
353,Why I get hungry now?? I had dinner 3hours ago ,,
354,"does not know how to remove people I don't want on here, anyone? I press remove but they come right back, makes Twitter really shitty ",,
355,hates when school kids talk about being &quot;FINALLY&quot; on holidays. I get four weeks a year gosh. I never have holidays ,,
356,"you know you're a bum when you think 10am is too early to be up.. i wanna go back to bed  man @dbuck82  , why'd you keep me up so late?lol",,
357,my vacation is going too fast  Housecleaning day,,
358,Part of me wants to go to the gym to blow off this steam before this big meeting but part of me is like f*** it. Need to talk to my mom! ,,
359,"I just LOVE when I get 5 difft emails, each w/ a difft Word .doc that I can't open from my email app (T-Bird). YIPEEE! ",,
360,sadden by the images in the News Gazette yesterday ,,
361,@SoGoPro your link isn't working ,,
362,@katmuro awwww... I miss my not batman cup that krystal made me..   How's ur grandma?  (GET THIS! I ACTUALLY prayed last night!),,
363,I don't like taking over a job for someone that was half azzin it ,,
364,I need to do some yoga or something. I've been so stressed out ,,
365,Is at home sick ,,
366,Can I go back to sleep please? ,,
367,http://twitpic.com/8dczs    i'm here but my hearts there. and so is all of the good parties ...   not inc. #glasto,,
368,"Just realized that I'm not actually funnier at 5 AM, it just FEELS like I'm funnier. ",,
369,in class again? are you serious?! ,,
370,Made it to the treadmill and I still fell like curling up and falling asleep! No nap today  We have Aquatic Preschool grad to attend.,,
371,Hi everybody... I'm at the library once again.... ,,
372,Got to go resign the lease  http://myloc.me/5AKu,,
373,Project Wonderful rejected me. ,,
374,@namyenoh I know  He'll just need to convince them this week. They don't know what they are missing. #y&amp;r,,
375,"could really use some donuts and orange juice right now  , but @padgettalicia has reprimanded me using the debit until more $ appears.",,
376,Dayum its only Thursday ,,
377,@countjackula what's wrong??  get better *cuddles**,,
378,"Today's going to be another one of those &quot;ohshitohshit I'm worrying about it&quot; days, I guess. I wish I could sleep at night. ",,
379,Borinnggggggggg! I hate the stupid cao forms ,,
380,  daughter's beloved diabetic dwarf hamster died in her hands this morning...all creatures are worthy of love. â¥,,
381,Test tonight. Studying all day... ,,
382,My Record   http://bit.ly/16FjE9,,
383,@vindee I won't lie but sometimes I really really miss it!  even like the spoon of sugar in my oatmeal... 3rs july.. Cant wait !,,
384,@marcia724 well its already kinda hot. i can't imagine being an animal with those fur coats year round ,,
385,watching I'm A Celebrity... Thinking about last night       ughhhhh!!!!!,,
386,@Welpje Where did you go? ,,
387,"@brandonleblanc Brandon, It seems there are some probs with the video embedding in other websites ",,
388,"Have u ever seen the things doctors do to our pets?? I mean, it's scary sometimes looking at thermometres poking to my cat's ass ",,
389,I don't think I can make it... ,,
390,hates @ashtonmelancon's schedule for the next 2 weeks. ,,
391,Every time someone uses Microsoft Word to create HTML an angel loses its wings ,,
392,"@BK_II lol, glad you didn't take that the wrong way. Aw can't tonight  You have work tomo?",,
393,@EmmaJaneR oh noes has the weatherman gotten himself a professional tweeter? ,,
394,"Not in a great mood, mothers are sooo annoying! and i have to go work soon ",,
395,Officially left school and hate it! ,,
396,Iss layin in bed cause my stomach hurts really bad ,,
397,@khaled_7 i think she's part trini...which can save us at least a very little part of the embarrassment. ,,
398,@equinorz was suppose to watch but i think not enough good seats uh ,,
399,I seem to be getting more pimples lately... maybe mum was right all along? No more chocolate for me. ,,
400,Anyone want to come to a gig at Fibbers tonight (in york) I have a plus one on the guest list and no plus one   ,,
401,getting my wisdom teeth out  ohhhh buddyyyy,,
402,@tomwisniewski tom I think if I were gay and you were kinda on the line we would make a great couple! I can only dream to be gay ,,
403,missing  the first 17 minutes of so you think you can dance  evil tivo,,
404,"untuk kesekian kalinya, d tinggal onyet pulang kampung.  not too bad laa, besok reunian anak* basket smanssa. HOPE MY DREAM COME TRUE! ",,
405,"I've got just the 3g  but, i want the 3gs because its faster.   ",,
406,ahhh...bill bill bill...  my pay's gone by just paying bills.. hmms,,
407,@bethrenaldi Sunday's game. Had a tix to Friday's game too but sold it b/c didn't realize it was during work hrs. ,,
408,im sad and scared. ,,
409,"Attempting to post the podcast, but WordPress doesn't want to play  The post is there! It just won't accept that it has a media enclosure",,
410,@luke01688 That's my exact Starbucks drink. And there is no Starbucks to be found... ,,
411,Going to 6 flags &amp; river walk. Dont think I'll have time to read today ,,
412,@freakgoddess @Nani981 why are you all making me hungry...  and @freakgoddess  i don't like veg kebabs . they dnt even come clse to NVeg,,
413,@komplettie yes happened to me in the middle of testing a program. Very annoying. And a waste of 16 hours!!! ,,
414,That was a mission. Hating the emptiness of my room ,,
415,"@BronxBebe4488 .. Thanks honey! Honestly, its starting 2 work! But this 1 person @ my job KNOWS how 2 press my buttons &amp; its annoying! ",,
416,is feeling slightly down now  not a good day,,
417,@richwareham Geeks in Space -- yup.  Another awesome podcast I discovered just as it was finishing... ,,
418,i'm scared that everything i studied is not enough ,,
419,wants Steve Madden Skipp oxfords SOO badly! ,,
420,@ShaddixXx Awsomee  i'm so bored :/ theres nothing to do here! ,,
421,@JCulwell you mispelled my name ,,
422,"fml. looking at old photos just makes me miss old friends.  though we're still sortof friends now, it's hardly the same..",,
423,Still no hair from Tom  http://twitpic.com/8dd4u,,
424,"working and wishing my back wasn't killing me, I barely slept at all last night! ",,
425,"@Drogheda_PC he also has an alter ego, bit worried about him   split personality disorder. LOL",,
426,Huge blisters on my feet.. owww ,,
427,@poshmarie What happened with Jazzy? ,,
428,Morning twitz! Stupid jury duty today  there has to be a way out of this....,,
429,My adapter won't fit on for my laptop. So now I am without computer. I fail  Need a Best Buy pronto!,,
430,still looking for the black briefcase ,,
431,http://twitpic.com/8dd5l - Me and my friend [ maybe ex-friend  ],,
432,"Going for a shower, work at half five again  Can't wait to dye my hair blonde &amp; get another tattoo. Any ideas on style &amp; location?",,
433,it's raining ,,
434,I hate being questioned! But I think im in the dog house  I think she gonna take the badge for today. Maybe I'll do whatever she wants!,,
435,why everyone speaks in English in here??  it's kind of... um...........................  well i don't know what to say ,,
436,@babygirlparis Wow Paris you're in Dubai? I hope you can help me get Hilton Hotel Dubai to sign up with us at DirectWithHotels.Com! ,,
437,"@James_Walton I was just wondering the exact same thing. Actually, its something I do every day ",,
438,@karenejones haha nice! The main problem with MN is that we have a 6 month winter ,,
439,Up puppy sitting ,,
440,is sad to admit he likes &quot;trash me&quot; from heidi montag ,,
441,oi...this migraine i hav is gonna drive me nuts like 4 real. cant even go bac 2 sleep...n i hav to work till 11 2nite :/ i...need...sleep ,,
442,Frustrating day - two new front end roles (so rare and precious) both in .Net ,,
443,misses the Clear lane at the airport. ,,
444,@andy_nash It should be great. But Thin Lizzy have dropped out as support. It's The Subways now ,,
445,headache ,,
446,"See, i knew it &amp; guessed correctly. Jealous now? Oh yea, &quot;Sour Sour&quot;. What 2 do? Listen to life song lo. ",,
447,i miss my homies  and i am sooooooooo bored. *iM*a*DoRk* &lt;= sooo true haha me and katie are the biggest dorks eva lol,,
448,"@FatherBob Hey, are you still doing Sunday Night Safran with John Safran? Or did he ditch you to do that new TV show in the US? ",,
449,"thinks if I dont take this, what will happen?  http://plurk.com/p/13w9sh",,
450,@lorihooood i knowwww me too! :| oh dearrrr. these holidays best get better aswell ,,
451,@DrJovi  girl please! QUIT?! ur out ur mind I would b ko'ed erday I'm telln u I get that meannn sleep spell from 9-11 I need something ,,
452,It's WORSE than the Madoff $50 bln fiasco...it's plain WORSE!!!  I been preparing for over 2 years...want to know how,,
453,going to the gym ,,
454,OOUUCCHHH ... I have such a bad headache !!!  ... http://myloc.me/5ALr,,
455,"I wonder if I should go out on a man-hunt this weekend..?? I just don't know if men are worth the effort anymore...Sad,but true ",,
456,Is sick... Gonna lay in bed alllll day! ,,
457,I really don't like mornings...I don't feel so well ,,
458,is at schooooool. havent had no dinner as us girls had to danceee  bad bad times.,,
459,"specially for @kopigao - im leaving 29th Jun, 1950h flight. SQ something to Christchurch. SO NOW U KNOW KAY!  so sad.",,
460,Can I get some followers I am new to this ,,
461,@comcastcares just caught wind of the Comcast/Time Warner online portal plans. I pitched the same idea to my company an got shot down ,,
462,@deathboyuk imagine what they'd have done if she was a Baha'i  if only the UN wasn't such a lame duck,,
463,http://bit.ly/lpzSP Mine doesn't do this ,,
464,Daughter &quot;graduated&quot; from preschool yesterday. So cute and sad when all the kids had to say good bye to each other ,,
465,"@markimbriaco  Microsoft is dragging its feet on the inevitable. Don't worry, I'll find a way to make it happen.",,
466,is a potential swine flu candidate... uuugh. im missing 2d classes  wrong timing naman.,,
467,is going to the grad thing this afternoon.  don't know why,,
468,Almost time to go home  Not much left from my Transformers induced good mood.. I'm mostly tired now &amp; cold...it's raining again (still) ,,
469,"@JessObsess I think he might  And hey, smemma can change! haha",,
470,I just wasted 3 hours due to bad form usability (italian passport renewal form = horrible) - life is too short for bad usability people! ,,
471,"Ended up doing the tai chi, pilates and yoga class at night, but not after getting extremely sunburnt!!! OUCH! ",,
472,"@Footdr69 OhhhH!!    Anbosol, stat!",,
473,got woken up and can't go back to sleep  people need to realise i can't fall back to sleep if woken up.,,
474,I wore my red flats to work today so i could magically go home when i wanted. I think theyre broken ,,
475,@ekrelly   notto  the  no rehab thing,,
476,My roommate just left me!!! It's lonely city!!! ,,
477,When I planned my costume for Sunday I didn't plan on having to cover it up with a rain coat ,,
478,"@MerryLark yeah, I can't seem to find a reliable source to determine if kiwi really is ok. Tweets from iran are on a serious decline ",,
479,Wowzers I don't feel good today.  And I didn't even do anything silly last night to feel so crappy! ,,
480,Gym ! Then Working eight hours  so excited to sleep tonight!!,,
481,"I'm sad because my brother is moving away today  and I have to see him off at the airport, must remember to take tissues! I'll miss him x",,
482,@NinaCSch I try to ... but the moment my thesis is freaking me SO out ,,
483,"Why Youtube, why? It's all gone wrong since Google took over  http://bit.ly/15Jned",,
484,Good Morning! Only got 4 hours of sleep last night ,,
485,@dallas_news Happy Thursday! No relief for us here  YIKES 100 try to stay cool,,
486,@Pinklilycat Bacon sandwich with cream though? Ugh ,,
487,Listening to Forever and For Always from Shania Twain album Up! ,,
488,Waiting on phone repair man. Hoping to have my phones working soon  Also praying this is a better day,,
489,@jenn_ski i saw it too but it disappeared again... ugh! ,,
490,Optus website is down. I'll have to buy my new iPhone 3G S 32GB on Friday morning.  ,,
491,"JEALOUS that I am inside at work instead of outside, in England, at Glasto ",,
492,Awake. Leaving for work. Totally shitty night because of no sleep. New room/bed. This is why I don't spend the night places.  ,,
493,@ucf0503 lucky u! im already at work ,,
494,@myasmine stole? After I let you fire an air barrel for your money back? I'm hurt ,,
495,@cosmodaddy  thanks. i think i had that until recently. it's so annoying. i can't twitter without a good phone app ,,
496,"Ãi thi vá»i cá»­ , tÃ´i cÃ²n 5 mÃ´n ná»¯a má»i xong. Cháº¿t tiá»t cÃ¡i mÃ´n VÄn báº£n lÆ°u trá»¯, tÃ­nh hÆ°á»ng ngÆ°á»?i ta tá»i nghiá»p VÄn thÆ° hay sao chá»© ",,
497,"N95 has gone to Nokia, will be gone for at least 3 weeks ",,
498,currently addicted to the tennis....... wishing i was at glastonbury though ,,
499,me sinto doente. ,,
500,"@JennyPumpkinx I would, but I need a job first so I can pay for insurance. No clothes shopping for me  Superlame.",,
501,1900  fuck,,
502,I cannot believe josh just ran a toll  I'm so scared of the fine,,
503,OM f!&amp;$%#? G! So i in to listen to some music on my i pod on the way to campus only to find out that all my music had been erased. ,,
504,Did you take anything? Is it still your allergies?  ,,
505,Going camping soon. Summer is SO boring so far. I need a car!! ,,
506,just woke up with the worst headache ever ,,
507,"taking it easy, trying to figure out what is happening to my old mind ",,
508,"Didn't find the treasure. So close. We were in the right place and when we got  there, the other people told us it had been found. ",,
509,article in Tribune on @Suntimes sale doesn't mention me...  http://bit.ly/Vd2Ou that's okay; there IS A PROFITABLE MODEL for @Suntimes...,,
510,wonders y she is so unlucky this day.  http://plurk.com/p/13waqw,,
511,got windows xp now running on my ubuntu laptop via virtualbox. Hey don't blame me it was a necessity. No mac emulators will work ,,
512,@dj6ual When I lived in Kirkland we used to get many little bats fly across the docks. None of them made any noise as they zipped by. ,,
513,my abs hurt ,,
514,@BluntBloke Was in Barcelona for Sonar followed by a fab day at Wimbledon. Back at work now... ,,
515,@veddersgirl lol Exactly. I cant even go NEAR the TwiRumorControl subj. Cuz I get tempted to peak in on them. Cant go to our home ,,
516,Last day in colorado  it was everything expected and more. Leaving for home around 930 to 10 pm,,
517,Ow my neck ,,
518,Did everyone know that Cheeks was at the forum last night? I DIDN'T! ,,
519,Babying my doggie - he doesn't look like he feels good today  ,,
520,@voiceofcritics:me to  iam on my way to the studio now,,
521,"@KimmieDavid I'm heading there now. I made a quiz, and it sucks. Didn't turn out right. ",,
522,@nicetobelieve nope  not til end of august,,
523,@joekwon80 I wish. ,,
524,"dropped kids off at vbs, got dunken donuts, came home went next door and said my goodbyes to elizabeth before she goes to columbus ",,
525,@brianakatlyn yep...the middle part is out of the shoe ,,
526,@rahma_dualeh now I am sad again. Don't leave baybay!!! ,,
527,@hypnoticzexy it was cut shorter than i imagined. I'll be growing it out again. It was just getting too thick. I miss it already ,,
528,Getting ready for work...not liking working on a closed ward...makes me slightly paranoid... :S ,,
529,"@frandoce es oviedo, ruta medica hoy otra vez, ahora atrapados por el chaaparron...waiting for my mouth to by scanned...still in oviedo ",,
530,Ian Watkins isn't following me anymoreeeee ,,
531,@astoryaboutmac I do not have a USA iTunes account ,,
532,"Der gestrige Sbend: StreetÂ´s on fire. the mob goes wild! Oder: Bang bang bang, vamanos vamanos vamanos. AUA, GehÃ¶r tut weh! ",,
533,"@xavire oh well, i still am getting mugged by those economic theories. just that this year is WORSE. ",,
534,"@the12kingstar  I wish I could cook as well as he does, he deserves breakfast in bed too. I can get by, but I'm not the best. sadly. ",,
535,"@rebeccawoodhead Yeah, I know you're right. At some point you get tired of the universal &quot;sneer factor&quot; in those comments, tho. ",,
536,my kids are having a pajama party today! i wore my hannah Montana pajamas! i forgot my teddy bear tho  SoMeTiMeS i LuV my JoB!,,
537,Someone from my office (who annoys me) met Leo when he came here in 04.  No wonder he didnt come back for the 08 election.  LOL,,
538,My tummy feels so wonky today ,,
539,@MPisthename aww babycakes!   HUGE HUGS. whats wrong? do they know?? KISSSSSSSS x x x x x x x x x x x thanks for listening to the PC xx,,
540,@Larryx360x am i too late? Im sorry i was sleeping ,,
541,@niicoleleiiman yeah! that was pretty much the worst thing ever ,,
542,@LarryTheWineGuy We're looking at North Carolina - I'd be spending 32% less on housing there.  I can't even afford a house in this state. ,,
543,"@krist0ph3r @hg6789 hmm,.. Its so difficult gifting a person, who has everything,.,..  ",,
544,Got woken up by religious nuts ringing the bell. Guaranteed to put me in a foul mood. Took ages getting back to sleep after ,,
545,"Oooh tequila, you get me every time. I foresee major dehydration in my future if I opt to go to the beach like planned ",,
546,"In the train to Groningen, it's warm, unpleasant and rich in luggage ",,
547,@JuiiCyeffBaby I didn't get to speak to her last night  lol nah i'll be there what u mean 288,,
548,quit smoking for 12 days and really messed up this weekend at the beach ,,
549,Waking up sucks. ,,
550,Lots of fox still here  they just sent some crowd wrangling minions home.,,
551,@tiarocks116 that sucks ,,
552,@GGGKeri Oh no!  Poor mom. That must include a long recovery time.,,
553,"so damn tired, who know EdiFact here?? even BizTalk hates using that standard why should I hardcode something like that in c# ",,
554,nxt wk Sunday is my Bday and Kyteman&amp;Anouk will be perf @ Westerpark. Don't have tickets  but will be there having drinks. Who's joining?,,
555,@Candy_Girl85 girl i know this was from father's day but drinking by the pool sounds soooooo good LOL! too bad i can't today ,,
556,@ElyseGardner you don't??? :O ,,
557,@DJLonnieB that's craaaazy....I was listening to lifes a b rite b4 I saw that tweet. I miss those days...miss u east coast rap. ,,
558,"My car is totaled, officially. If I lived in the east end I wouldn't even need another car.  What can I get for $3000? ",,
559,@DREEE9 my throat killllsssssssss &amp; i lost my voice.. kill me lol ,,
560,Feeling very tired today and a little bit fed up as well don't know why!! ,,
561,"Not so good on my Exams, ill be here next semester  *Jixisticks*",,
562,Red Roof didn't pay commercial laons 361 Mils  http://tinyurl.com/noud75,,
563,@NEEDISAYMORE09 Damn! ok  I think Im gonna make me a list too lol I been accomplishing a lot of my personal goals so far,,
564,is depressed.  I guess i just miss home.,,
565,I'm a bit nervous right now ,,
566,"A bit late, but here. Fucking moving van was double-parked on a sidestreet, adding 20 minutes to the trip. I hate driving tired. ",,
567,@ewandodds yes i think so  but i hate going!! &lt;3 xxxxxx,,
568,I feel so sad since Gavin needs to go back to the Philippines soon! It's really breaking my heart...   http://twitpic.com/8ddhx,,
569,I almost cried this morning when I realized it wasn't Friday  One more day until I can see my kiddo ,,
570,@freakgoddess   i wish i could have some ... Anways enjoy.. see ya tmrw... ,,
571,"Bom dia, twitt population! Have a nice gray day! ",,
572,Is with mi madre! I feel sick ,,
573,"@jedson328 but Karl just knows so much more than me!!! It didn't work anyways, though ",,
574,I must be the only person left on the planet who still visits the Strobelight page ,,
575,@_scene_queen_  haha lucky!  OMG my lover is in the hospital. ,,
576,Massive headache ,,
577,I miss my computer ,,
578,@crimpomatic stuck in meetings all day so can't get out into it  but it is beautiful 4pm finish for me I think &amp; a nice walk home =^~_&lt;,,
579,@ShibbyJinkes Damn  ,,
580,I need to write a story. It's due tomorrow. And I'm stuck with an introduction about a hotel and a young couple checking in. AHHH ,,
581,i dont feel well at all ,,
582,@kaitt32 yeah :| two of dem  HOWS SPAIN MY WORLDY BUG?!?!,,
583,OMG WTF  . BUT AT LEAST I GOT A NICE PIC OF JOE JONAS  . oh my fucking God... I even said I was gay at the last question! Damnit!,,
584,is going to be phoneless till sunday . . . . ,,
585,Heading off to work ,,
586,Resumed a languishing summer tank project and recalled why I keep putting it down. Non- springy cotton knit too tightly. Hurts my fingers ,,
587,JMDP  maybe you're not *that* ready for grass yet..,,
588,I'm sad about jon and kate..srsly the media made everything a lot worse! I hate when the media turns vicious..its really scary.. ,,
589,Definitely lost too much weight when my butt can't even hold up a pair of skinny jeans... ,,
590,I just can't figure out what to eat tonight  anyone an idea ??,,
591,Really doesn't wanna go to work today ,,
592,@Tobias_Reuen I don't know what I shall wear ,,
593,"Was in a good mood, until i found something out that someone told me about what they said. D; Proper put me down. Fucking nob. ",,
594,"@milonguera I lost my favorite pair of leggings to dance in  and also, in no spend mode. sniff sniff #tangothursdays",,
595,"@Steve519 Oh yeah, you're right!  What a traumatizing insult.  I don't think we'll ever be the same again after that ",,
596,Prayers are with Farrah Fawcett &amp; her family . I hope she is feeling no pain ,,
597,@saynofx viigo is ugly  need something simple,,
598,@bungatikha i know right ,,
599,@a__guy no windows here either as I'm in a shopping centre  glad of air con tho!,,
600,says I'm feeling fucked up nao!  GRR. http://plurk.com/p/13wbtr,,
601,What the fuck is wrong with everyone today ,,
602,oo how beautiful it is 2 wake up 2 da lawn mower  ...ugghh,,
603,fighting really takes it out of you.......   so does working at tmobile,,
604,We found a dead bunny in the backyard this morning   Rip little one .,,
605,Soooo tired. Up an hour early cleanin ,,
606,No power on central campus.  no Internet for my computer... Thank goodness I've got my trusty iPhone!,,
607,Working on a logo for a missions group. Love working in AI don't do it as much as I'd like. ,,
608,Working on a logo for a missions group. Love working in AI don't do it as much as I'd like. ,,
609,@naveenie Oh no!  You have a fever? ,,
610,My hair straightener joined ed mcmahon and bea arthur in the 2009 celeb graveyard ,,
611,i think it is starting to rain... thunder-storm...  i'm scared.,,
612,@shinginbox Pois Ã©. ,,
613,Beach is nice. Fried like a lobster ,,
614,"@Graendal There are  Though what I've done so far wasn't soo bad - you just look for dodgy data.  Ther rest is just math, as far as I know",,
615,@precious85  no that stinks...  hope the cafe will hire you!,,
616,@jamhess I'm sorry.  Is it the meds still?,,
617,"Just realized that I don't have enough money for rent this month . . .  I just want to curl up in bed and watch HIMYM, not go to work.",,
618,@garethslee all I need to do now is add proper error handling ,,
619,@hdconnelly At least you have a good excuse for not shooting. I just haven't seemed to make the time. ,,
620,getting ready to go to work its sucks ,,
621,"O good lord, I have to learn how to use Castor. And I don't mean the sugar. Someone please kill me ",,
622,my arms are sore from swim practice. ,,
