,text,time,hashed_value
623,is craving a pack of crisps but im on a diet  lol,,
624,can't send sms in gmail anymore ,,
625,just wokee up.....I miss my aaron ,,
626,@avenueofthearts That link doesn't work ,,
627,@Has_Bookpushers I should probably go through them. I ban the one with ho..y and ho..e ones but maybe I should look at all. ,,
628,@fridgi Thats odd.My RC(since the1st beta)has been absolutely fine.I also love3.5(also ABP addon)but the memory usage vs SW Iron/Chrome ,,
629,I'm hungry but I just can eat fruits ,,
630,"@EBone Nah, I ordered the Boa Slim Case for my MBP in some online shop. It should save me 20â¬ if they ever deliver ",,
631,@fortworthdiva You be careful too.  I dn't know what our heat index is here in SA but it's supposed to be another triple digit day.  101 ,,
632,Wine rack fail! It was completely loaded with Chateau Neuf du Pape  http://tr.im/pIMn,,
633,"Oh my gosh, I wish we would've taken a plane. ",,
634,"missed Ryan every day this week  , but thankfully, he will be home tomorrow!",,
635,"Ok my ipod left me a few mins after i said that, my teacher spotted it in and told me to get it out ",,
636,Why is the Ocarina of Time so expensive? ,,
637,I haven't slept in in a long time. ,,
638,I want some candy! ,,
639,@weefieryredhead i want an ice cream van ,,
640,@mulimuy why are you in banduuuuuuuuuuuung? ,,
641,@nigsbrizuela take it... i ate too much ,,
642,daddy gone ,,
643,"@CaptainJack4 Too right, especially on uploading ",,
644,@peterfacinelli No love for Canada..must be US citizen to enter ,,
645,@jamhess hey sweetie!!! And now I have to go again!!! ,,
646,On my way to the damn doctor.  i hate being sick.,,
647,I'm really tired. I want a guy to be sweet to me like Emma's boyfriend in Degrassi. ,,
648,Damnit my iPod is out of battery. How will I survive the train ride home? ,,
649,"@GeeNote no, I feel like trash, sitting on the sidewalk, but not so smelly!! My head hurts ",,
650,ER wit mah daughter.... shes not feelin good at all ,,
651,happy crush where are you?  http://plurk.com/p/13wcj4,,
652,Am I ever going to feel not sick again?  ,,
653,@ChargerJenn aww I think working on our entries made you sick!! ,,
654,@thisisbree awwww ,,
655,That was a lovely shower. Likely the last one I'll be having here! ,,
656,I woke up too early today ,,
657,"@ms_senita lmao, but its gonna be hot today ",,
658,Didn't wake up happy  I have a frown on my face. Ughhhh not excited for class.,,
659,@Girlfriendology that is such a true quote I miss the friends I moved away from  life was just sweeter then,,
660,long hair and cute...but single ,,
661,I miss my red hair ,,
662,"@birdofparadox &lt;3 ur deconstructed pesto salad recipe, maybe I'll make it today!  And did  you c who's coming to J-town?  G Baum, YIKES!",,
663,In PE  fit BB -&lt;3 I'm sitting out,,
664,Someone just said they hated Resident Evil 5 because it &quot;wasn't nearly as scary as Resident Evil 4&quot;.  ...RE4 was also not scary. period. ,,
665,@jordanknight On 20thJune at 7.30am you said you'd talk to us tomorrow.. it never happened.. Why?? What's happened..we offended you..?! ,,
666,I didnt eat breakfast this morning ,,
667,Gonna see the hangover today with zora. yay. Wish i had bought 311 tix ,,
668,Please don't bank with #abbey / #santander - absolutely useless business banking. Have locked me out of my biz account for 2 months now ,,
669,@carolz_place Been Hot in TN for weeks  The air has been on all month. Thankfully yd &amp; this a.m. is cool enough 4 open windows. Blessings!,,
670,"common denominator of my last two not-feeling-well-moments, OYSTERS!  Someone tell me what to do   (via @mwfishman) if good place, allergy",,
671,"doesn't feel like twittering much, and hasn't been in the past few weeks... ah ",,
672,"I love you, be mine again ",,
673,"@coollike http://twitpic.com/8d0kq - I wish I got DWM. I live in the states, so no luck there ",,
674,@suedahlgren  ok i will watch.,,
675,OMFG ouch! something just went snap in my elbow &amp; now it *really* hurts. ,,
676,... but no special Windows 7 upgrade pricing in the EU  http://is.gd/1d6Ja,,
677,"hmmm, diagnosis on left computer speaker suggests blown tweeter ",,
678,"@canvasxyz isn't it though? I've been waiting for the new cd forever, and of course there's no hot topic near me right now ",,
679,Why  am i up so early ,,
680,I'm working tomorrow   Dunnes sucks ,,
681,"@emencia too late Rodge for Den's  But soon, when I'll get rid of my kids ;)",,
682,I didnt win jonas brothers tickets on the radio.  well theres always tomorrow...,,
683,I was unaware that my face could get this fat.. ,,
684,Getting ready 4 tonight.. Im tired now dammit  Hope everyones having a gd day! xxx,,
685,@mileycyrus cravin for sushi too ,,
686,@graemeb00th why didn't you come say bye bye ,,
687,"so i went to the doctor yesterday and got a shot, after effect sucks! it fxckin hurts like hell ",,
688,"I'll be here all weekend  so no excuse to not go to church this Sunday, see you at 11:45 Pastor West",,
689,is going to miss her good pal @Stephyyy  x,,
690,@GrantMc thats awesome  howd you know though? yvonne told my group we had to wait til basically we started back to find out the grade ,,
691,I think he has realized......I feel relieved..... and lost ,,
692,@Blatter PS hope you know how lucky u r to watch rugby on tv. In the states even the rugby bars aren't showing the Lions tour.  ,,
693,"@tim_mckee I wish... it was Bill, as in Gates. ",,
694,@TewiTso Hey girl! Doin' ok here! What's up with the internet?? ,,
695,oooowwie! cookies are hurty! ,,
696,"at work feeling a little down... @ohmygela nice! Imma visit your site again a little later... and oh, try to rest for a while... ",,
697,Advice for the day: Don't fall asleep in your contacts.  My eye is wicked bloodshot and it burnssssss.,,
698,@maggieshiels I have to say that's probably one of the most disappointing links I have ever seen. I was expecting something scifi ,,
699,Leg is so swollen. Hurts to walk ,,
700,@katiepennington @isaacrs @raphsangiovanni nothing worse that a horny bird who tries to distract &amp; sneak a peak! Pfft! Are you ok though? ,,
701,is wishing he was in DC so he could kick it with Paul Rudd. ,,
702,www.redcarpetdachshunds.com for the Cutest AKC Mini Dachshund Puppies! Only 3 left  Expecting Chocolates &amp; Chocolate Dapples Soon!,,
703,@minibite17 i thought u said i wasted my time wit it   but im happy u found something funny w it.&amp; i do kno where my rock is its at school,,
704,Studying for 4 hours until 330 in the morning and im up already ,,
705,trying to fix a 1TB lacie drive... blue light keeps blinking and it wont mount on desktop. #hardware trouble ,,
706,"@ maracaibo, again    &gt;(",,
707,"Worrrrrk, this attempting to be a grown up thing blows ",,
708,"Soooooo tired, I wish I didn't have to work today all I want is my nice soft bed... ",,
709,@CrackUpBoom haha the way my day is going that sounds like a good idea! too bad I have a meeting tomorrow ,,
710,@gracielaM ohh really??I thought they were germs ,,
711,@IDKWHYIMNAKED lil mama...uhmmmmm? r u on cociane in NY? nah they all still like 3 and up ,,
712,Dieting is sooo hard I just want a big mac wit fries a Hi-C with a 4piece nuggets   http://myloc.me/5AQa,,
713,@Nicoleos But I'm doing them anyway ,,
714,History is killing me  And I forgot almost everything that has been taught in school before the holidays.,,
715,@KateAnstey what time are you getting to victoria tonight? I can't stay out long - think I am getting a cold ,,
716,O.MAI.GAD!!! I NEED TO BE WHERE PP IS NOW  AHH MASKED HONGKI MASKED JAEJIN MASKED JONGHUNMASKEDSEUNGHYUNMASKEDMINHWANOMIGADDD *SKILM*!!!,,
717,"scared,mad,sad ... all of it ",,
718,Crews depolished wrong house based on GPS coordinates !  http://oreut.tk,,
719,Had a small accident this morning.  Guy opened his door while I was pulling into a parking spot. I stopped but by then it was too late.,,
720,@Nathan91 - I wouldn't even know where to start fixing it myself. Sony will charge me a bomb with no receipt or warranty ,,
721,@renekasbergen that is mad! tried doing it from here and i can't ,,
722,@untuckem Aww... I missed out on all the cool stuff ,,
723,"@thewild aww, I hope your dog gets better! That's awful, what's wrong with it? ",,
724,Headed back home - Job; oh we so sorry Gail we didn't need you this morning. Me; ,,
725,Twitter on my phone is getting annoying Ahah. At summerschool ,,
726,doesn't really want to work for 9 and a half hours tomorrow. Just wants to spend a proper day with her baby.  Pancakes smelling good!,,
727,kids are ready go see Mickey Mouse!  dang no sleep for this chick ,,
728,My fringe is just not doing what it's supposed to today  .....,,
729,My lil ones are gone for the summer  I shall miss them. Now... time to focus! Moving on...,,
730,I wanna see transformers 2 but itshows @ 12 2nite and im goin 2 the airport at 1 ,,
731,ugh i'm up...someone shoot me! Goin to Sanford...god i hate mornings ,,
732,Moo.com is broke  another bummer!!,,
733,@sampan22 Hmm...well i have my spies out there who will be investigating his disappearance..Lol.. I just miss him   Kate is gonna have FUN,,
734,so tired couldnt sleep good last night ,,
735,@vh1sCornfed  I'm sorry my lil chick-a-dee! I'm gonna give you a call next week...enjoy the rest of your time home...say hi to your bro!,,
736,Has to learn to prioritise things better. ,,
737,"*sighs* Has been up since 5am for no freaking reason! Laid in bed for 2 hours, still couldn't get back to sleep. Is ooohhh sooo tired. ",,
738,all I did was to reach out // what a great way in responding ,,
739,"Worst.Hangover.Ever. Need healing potion ASAP. On second thought, sleep better. Still can't find my staff. ",,
740,hoping my cousin doesn't stand me up today ,,
741,@tynanhooper I hear ya... unfortunately the boss has a file review 2mr with a client so I have to get the review sheets done on all files ,,
742,@211me no love for canada...usa citizens only ,,
743,"@redsrule85 nummi is icelandic slang for sweets, no nummi today  funeral today",,
744,Pray for me - I'm facing one of the hardest days of my life... ,,
745,@papeylad thanks ,,
746,@indiesoshameles how the hell did I become a dude?? cuzo...uggghhh. I feel sick today sis in law. I wanna go home....come save me... ,,
747,@shermartelle Sorry to hear that!  Though you can follow all the action  with the #PrideTO tag: http://bit.ly/14w3No,,
748,"Eating breakfast @ Mioposto &amp; having a cup of tea...Big monkey don't drink the almond milk. 7g sugar, cane juice, it is not unsweetened ",,
749,"my twitter is pooor! LOL, guttted for me. i need something exciting! ",,
750,@shermartelle Sorry to hear that!  Though you can follow all the action  with the #PrideTO tag: http://bit.ly/14w3No,,
751,http://twitpic.com/8ddwj - I know it's blurry but this is my first sighting of a Junebug this year ,,
752,@221me How can I be sure that I entered before it got overloaded? I THINK it worked but I'm not 100% sure ,,
753,"@thenaturalbaby soooo wish i could be there, but i won't be able to make it saturday.  i hope it goes great for you!",,
754,I miss my boyfriend ,,
755,"Work. Ughhh, I rather be sleeping ",,
756,Sitting in the doc's office waiting for them to retake my blood pressure ,,
757,@KaylaNicholeG I miss Trina too and you  I even miss the room of death,,
758,"Meet at four! waah, i'm semi-tan...and it hurts  mishin' my boy.",,
759,Can't hardly wait for the Blackberry Tour. Wish I had it now ,,
760,"@Stuartcfoster months later, nothing happened. :\ ",,
761,I don't know what I'm going to do next week. ,,
762,oh god I am sooooo bored! i do'nt really wanna update cause then i'll have more updates then followers  but the boredom is takin control..,,
763,my tummy hurts. ,,
764,is wondering if her hubby is dying in this head?  poor guy ,,
765,@patricv1206  I miss u too darling ,,
766,no food at the kentland rec centr food bank ,,
767,had to put my dog that I grew up with to sleep ,,
768,"Packing for australia right now! I don't think I have enough to do things  ohh mann, I need to hurry up!",,
769,@JuliaSiddle oh I'm still in year 10  School sucks,,
770,oh my dayss! im so tired  I feel like crap! &amp; this woman on ebay is being a cow.,,
771,Good morning all- looks like a few more clouds today and cooler in NW #PDX  Oh well what do you do? It's my day off...,,
772,should think about heading to bed... work in the mornin arrggghhh    ,,
773,@carlybug Yo Carly! I do indeed! Sorry I wasn't out on Friday... was ruined by swine flu. Or possibly bird flu ,,
774,Dec seems year2100 ,,
775,i'm so angry about my geometry teacher! if he didn't lower my grade i could be head of the class! ,,
776,I need someone who knows to fix Macs. I don't want to sell my iBook G4 on eBay for parts!!! ,,
777,Needs a Hug  Any Offers?,,
778,"OK, i can't watch tv tonight, crap, i was about to watch the cw  my tv doesn't work!",,
779,ughh. why does he have to be so cute?  damn it. haha. life's so cruel.,,
780,Storm clouds have cleard (at least temporarily) albeit the humidity remains to keep us wet in sweat!  ,,
781,Missin my princess.. Missed my mornin kiss   she's spending da rest of da week wit her aunt n cousin.. Want my gmornin smooch ,,
782,My puppy Junior is not a puppy anymore  almost 2 years old! But now he is like a teddy bear so cute he is. Dog Therapy. Adopt one too! ,,
783,@nikkidecoy I'm so sorry to hear that ,,
784,@sunnysully1  sorry about that bar tweet. I don't do this too often.,,
785,@Carly_FTS I am lost. Please help me find a good home. ,,
786,"too much food I think for today . arghhh , obesitas nii lama2x ",,
787,"love to wake  up to a cup of coffe madeby my pops , so good. now im bored and alone and its too early ",,
788,@bonsoirdollface We're practicing graduation today. ,,
789,"@KissMe_ImEmo Hell yeah, she is. I've have seen a couple of unflattering pics of her with no makeup on, though ",,
790,transformers was awesome. but not enough megan fox fap material  hahhahahahaha,,
791,@TravisLegge Rubiks cubes can suck my non existant dick. I've never been able to finish ONE ,,
792,This song is upsetting me way too much. I cant stop listening to it when Im on the computer and I cant get it out of my head when Im not. ,,
793,i'm missin' sour sallyy!! ,,
794,@macbella2 a month I think ,,
795,"@uncouthamerican but they're knocking down the old part of it, gaaah do planners never learn ",,
796,I'm nervous that I may have messed up my 100 average ,,
797,@nkdaydreamer I've been up since 6 and not getting to bed tonight til gone midnight. I can't function as a boss being up 18 hrs ,,
798,is wondering if her hubby is dying in this heat? poor guy ,,
799,@katiejconway  leaving me yet again.,,
800,What awful punishment as soon as I got the all stools sold out page Circus came on the radio.  Sold out in freakin 3 Mins!,,
801,"@smileylady seeing the blue sky is torturous..and then don't u know it,come wkend it'll rain ",,
802,@jennyhanny i can't find lawn seats for blink 182.... ,,
803,@ehrenc ouch you hurt my feelings! but I really had no energy to talk yesterday ,,
804,"waht a bad day, but the wetter is hot ",,
805,i miss him so much  what is going on with him?,,
806,I miss my straightener. ,,
807,i didn't win tickets for the harry potter tour in holland. ,,
808,"@afterworkinc he cant go anywhere .. he is on lockdown. no travel, sux  @projectzeroent u better be there! i have 2 make up 4 yesternight ",,
809,ccmulan q neun.....sna mayari q s saturday :'-( iReallyMissHim (tears) langan gawin for mmrz )  http://plurk.com/p/13weiz,,
810,Is back home for the first time this week. I miss DJ. It feels different to be in bed alone now. ,,
811,@JamesParrish I can see outside from my office window. It's not the same  I am jealous x,,
812,is not having a good night ,,
813,just realized that zoneedit was down since yesterday!! that's the reason why i did not receive any mail ,,
814,@superchou i am aware ,,
815,@jennihof OH goodness that is awful. ,,
816,@Tay_Tay305 WHERE YU BEEN AT BOO??? YU DONT DM ME OR NOTHING  ,,
817,Now I see why people like to drink just washes all worries away. 2 bad the pain is still there afterwards  Miss her you forever Tee,,
818,"I won't sleep today, I'll study study and study! ",,
819,my charger is messing up  shucks!,,
820,Trying to get the damn website to load so I can get tix to vfest as well....My computer is slow! ,,
821,just looked at the line up and theres no McFly ,,
822,"Crap. I just realized, after it is now empty, that I have been using non fat-free Coffeemate all week. ",,
823,"Ive been reading steampunk webcomics for the last 2 hours. got to get my life right, visiting the baby + @FriendCatcher missingladydjnite ",,
824,@RocknRollPhotog yes  my life suxxx,,
825,Drinking French Vanilla coffee @ work.Have to pack clothes 2night 4 my roady 2mrw.I dont want to leave @sneeke04.I want him to come with ,,
826,its cold  i think ima go back to sleep coz i need to go to school but i feel sick ,,
827,@rebecca8888 im leavin nw lol cn u plzzz bring hayfevr tablets!! I 4gt agen! &amp;no cred 2txt u!  x,,
828,I HAVE TO SAY LOSING SOMEONE SPECIAL NEVER GETS EASIER.AS WILD HOUND DOG WOULD SAY BARK BARK.HELL I DONT KNOW WHAT THAT MEANS   ,,
829,my ponytail has been threatened and someone told me if they got a hold to it it would be set in a blaze ,,
830,"Think I'm going to have to go to a doctor today, shoulder is killing me, and it's my spanking arm ",,
831,wowow!!! i can't believe that i'm not going to flordia anymore. i'm so so so sad  but at least we get to go to six flgs on da 4 of july!!!,,
832,lame work for 7 hours!! ,,
833,@calvinography Whose playing atm? I'm on a train and no tv ,,
834,"At work, such a nice day, wish I was out driving my 69 Mach 1 Mustang ",,
835,the NBA draft is finally here..today it will cut into my nape time..  but its worth it to say the least. off to get ready for work..,,
836,im frustrated with this place. how does it work? will I ever know? Do I already know and this is it? ,,
837,I have NO signal @ this place! I have to go outside to send a message. ,,
838,I'm so ready for the weekend. ,,
839,Jury duty  hope its at least a good case!,,
840,Met @deeptialla at fc today. Her arrival saved me &amp; sowmya frm  some of d pj's @horrormeister was crackin. She left &amp; he took ovr agn ,,
841,Just got out of work. At school now. Going back to work afterwards. ,,
842,http://twitpic.com/8de3z - i tried to make it look like a football pitch haha!. Bored of harry potter ,,
843,"Going to listen to All time Low, The Academy Is..., Fall Out Boy, Panic At The Disco, and 3OH!3 while on tan. But not my back it's burnt. ",,
844,doesnt feel well someone come take care of me please?? ,,
845,RIP Prof Phillips  I wish I had the chance to actually take your class.,,
846,"wrote to Music Jam after a long time. But, sadly, they didn't even bother to read it ",,
847,Just waiting for everyone to wake up so I can stop talking to myself  http://myloc.me/5ASd,,
848,@PanaJ. Awwhhh I wanna go  but I gotta to 2 VA this weekend Tell her Happy Bday for ME,,
849,"@cozmosis nah, just kidding, say what's so special about bilingualism? I myself am bilingual and I feel it might never be enough ",,
850,Got a parking ticket yesterday   The roof is being fixed. A neighbor called in and complained. Going to try to get out of it later today.,,
851,I have to go to school today? ,,
852,Mmm #identica seems a bit broken after the upgrade ,,
853,"@Jedi_Amara I would go if I could, really  Good night xox",,
854,@MajorProblem  That sounds so good. You are evil. Next time keep that info to yourself. Sigh...,,
855,http://twitpic.com/8de4k - we had a contest to see who could hold water in their mouth the longest lol...i miss them ,,
856,"10% battery remaining on iTouch.. No music... No twitter., no faceboook ",,
857,@ricksva Day-long teaching admin meeting ,,
858,@FemiThompson I feel as though I am the only one that has not seen that movie yet ,,
859,I'm such a wimp  I hate sleeping in my bed for the first time alone after I move it around... -shakes-,,
860,wants cuddles ,,
861,dll coding ,,
862,can't go anyways theres no tickets left  ,,
863,@iampolariis I would if I wasn't where I am ,,
864,"Gonna be a long day of tattooing, St. Vincent show, and birthdays. Wish I felt better. ",,
865,@Stagehouse oh my god! I didn't know. I'm so so sorry. Your Gabriel looked absolutely lovey and beautiful.   I am so sad for you...,,
866,@tweetdiane But didn't have any memory left for One Song &amp; when I showed her the 1st 2 she asked 2 watch One Song.   I'm a failure lol,,
867,I need to mow my lawn before the PAR-tay.   I hate mowing.,,
868,"after 1000000 iterations, all i get to see is a single hazy blob against a grey background... ",,
869,Finally thru and waiting to board the plane. Man I'm runnin off of like 2 hours sleep  holdin off on coffee till we land.,,
870,@moonfrye when I opened up my mouth within earshot of someone and said something I should have kept to myself ,,
871,"@tlockemy That sucks    Yea, our maid charges $65 and thats for 2 living rooms, 2 bathrooms, kitchen, common area floors/stairs...",,
872,3rd time on the pruple line someone has fallen asleep next to me and i've had to shoulder push them of of me ,,
873,Wants to see Transformers 2 but has no one to go with 2 see it ,,
874,vou ler shakespeare...  ,,
875,"@stickmoneybags Hey there! Thanks. this is the third time it is happening, so now I am finally going to the Dr. about it. ",,
876,Almost all the pink has washed out of my hair now ,,
877,@xlizziebx  btw vote for sophie http://bit.ly/xzADK and re-tweet it ;),,
878,Missing my Sunshine more and more every day ,,
879,I've got one more week to enjoy before college. DANNGG ,,
880,wow my rooms tidy :| haha:') Starving never had no breakfast or lunch boo  So much dust flying around hahah,,
881,@lauratownsend88 well done! is that cus they won't be as cheap lol! Lets see if it lasts when u have more exams wen u go bk ui ,,
882,@NeriG Nope! Stop harrassing Jon.. Haha. If they follow u nope u can't send a DM ,,
883,I don't think I was cut out for a 9-5... I need to be somebody's house wife and have some activities on the side for extra cash ,,
884,@StrBrght1130 I saw that your shit grew....mine didn't ,,
885,@MsMurdaMami haha what?! its going to be BAKING today  and crack (chipotle) on a hot day is never a good idea lol,,
886,Leaving dallas today  but coming back....different! Peace is necessary..,,
887,@yliesan I never got any. Huhuhuhuhuhuhu   everyone's are just to fast. Lol,,
888,@RachelOliv Yh it's nice.. Sorry my phone was out of battery so I couldn't tell you when I arrived  ahh you need to come with me to ny ,,
889,@kaddisfly what's wrong with 6pm? ,,
890,i am getting ready to go out but im so tired ,,
891,Love finding out that I have to work sat ,,
892,At work doing my math homework. ,,
893,im scared to look at my SAT scoressssssssssssss ughh; it's gonna ruin the wonderful mood that im innn ,,
894,@_scene_queen_ he punched glass and he has cuts and shit all over his hand! ,,
895,i want to go ayg what is this ugh so stupid ,,
896,wants rain.... neeed rain. My head hurts ,,
897,"fudding hell, surprise news from Fighting With Wire is genuinely surprising...bit shocked, and sad...was so looking forward to their set ",,
898,@MikeRuocco Wish I was gna be anywhere NEAR NYC cuz I would SO be there... unfortunately the bank account won't accommodate.   Come 2 STL!,,
899,"But then again, I'm trying to amuse myself with how the family pc can be really slow and very program-less. haha I don't even have YM ",,
900,@michalvitasek Se zÃ¡kladkou? JÃ¡ jsem nedÃ¡vno mÄl sraz po deseti letech od maturity ,,
901,@KTDP Ukh 3ad I never do ,,
902,wishes tomorrow will never come ,,
903,"@ChrisOlstrom and @danielstroud , @persiankiwi is on the run, hopefully. One of them was captured and they believe names may be revealed. ",,
904,At the docoter. ,,
905,At the doctors office ,,
906,No work for me. Doctor then back home to sleep this crap off. Oh i feel bad  al&lt;3,,
907,starting my morning with reading microsoft's outlook reply to the campaign looks like its futile ,,
908,"i want a cookie, but there is absolutely nothing of the sort in my house ",,
909,"Help us grow our facebook page, it only has 4 fans ",,
910,is not at glasto ,,
911,Got sick  but workout anyways :p can't give up now!,,
912,"The weather dude said the sun was going to come out today but, yet again no freakin sun. It's so depressing. ",,
913,"@chiniehdiaz Sometimes, it is! Now I feel bad about it. ",,
914,@x1n Totally. Loved the last few House eps of S05. Now the long wait to 06 ,,
915,is missing you badly  http://plurk.com/p/13wfvo,,
916,@kaylinstone ...10 days?  that's not very long.  ,,
917,@Karboso .. OMG! U were online forever!! I felt bad when I woke up this morning! I didn't know u were still online. I should've checked! ,,
918,"i've had nightmares of some kind every night this week, starting Sunday night. had a really scary one last night, couldn't sleep again ",,
919,such a pleasant day and i m in the office... ,,
920,eeek induction day!! ,,
921,@Monsteraisin NOOOOOOOOOOOOOOOOOOO....I jealous of your friend ,,
922,misses singapore much  can't wait to be back. 2 more days.,,
923,@xslverwingsx oh... im sorry claire..  .. but on the other side.. u should've taken a picture of that..,,
924,there is a dude playing roddick at wimbeldon right now and his name is kunitsyn... makes me think of my kuny ,,
925,@Mizzbehave193 Don't like the new pic ,,
926,"I miss all of my Thursday Meals Kitchen friends.  Mark, Erica, Nick, Sarah, Adam, Laura, Libby...I could go on. I miss all of them. ",,
927,ahh it's still sooo hot in here   hopefully they have the AC fixed at work today,,
928,@FiveLives it's Thursday! Because I work today. ,,
929,a or s? or stay? ,,
930,"hates kristin stewart's look on her new movie...  she looks like a freaking ZBZ nightmare... and that really doesn't look good, trust me.",,
